{
 "id": "neon-night",
 "tier": "hero",
 "title": "Neon Night",
 "title_zh": "霓虹之夜",
 "line": "Rain on glass at night: neon rim light, passing light streaks, a slow push-in, bloom and a synthwave bed.",
 "line_zh": "雨夜玻璃：霓虹轮廓光、掠过的光带、缓慢推近、辉光与合成器浪潮配乐。",
 "prompt": "Neon night style: the scene through rain running down glass, magenta and cyan rim light, passing light streaks, a slow push-in on every shot, heavy bloom on the practicals, light-leak cuts, a synthwave bed over the rain.",
 "prompt_zh": "霓虹之夜风格：隔着流淌雨水的玻璃看场景，洋红与青色轮廓光，掠过的光带，每个镜头缓慢推近，实景光源强辉光，漏光转场，雨声之上的合成器浪潮配乐。",
 "essence": "A city night seen through wet glass: cool neon around the edges, one warm light inside, and a camera that leans in slowly. The glow is atmosphere around the subject, never on the words.",
 "not": [
  {
   "style": "retro-crt",
   "difference": "Retro CRT is green phosphor in a mono face with scanlines; Neon Night is soft bloom and bokeh with a sans face."
  },
  {
   "style": "chrome-product",
   "difference": "Chrome Product is cool, metallic and restrained; Neon Night is saturated and warm-hot."
  }
 ],
 "palette": {
  "logic": "a deep indigo night, near-white ink, ONE hot magenta for the key word and the button",
  "paper": "#0B0A1F",
  "ink": "#F4F1FF",
  "accent": "#FF3EC8",
  "muted": "#A9A3C9",
  "contrast": {
   "ink_on_paper": 17.52,
   "muted_on_paper": 8.14,
   "accent_on_paper": 6.29
  }
 },
 "type": {
  "display": "Manrope",
  "text": "Manrope",
  "weight": 800,
  "case": "sentence",
  "max_words_per_line": 4,
  "presets": {
   "headline": "type/charStagger",
   "card": "type/charRise",
   "end": "type/scaleSlam",
   "sub": "type/blurIn"
  }
 },
 "motion": {
  "personality": "energetic",
  "ease": "enter",
  "overshoot_max": 0.08,
  "asl_s": [
   0.9,
   1.8
  ],
  "camera": [
   {
    "move": "cam2d.crashZoom",
    "expresses": "a rush into the light"
   },
   {
    "move": "cam2d.breathe2d",
    "expresses": "the city breathing on a hold"
   }
  ]
 },
 "transitions": {
  "by_reason": {
   "EMOTION": "transitions/lightLeak",
   "STORY": "transitions/cut",
   "RHYTHM": "transitions/lightLeak",
   "ENERGY": "transitions/zoomThrough"
  },
  "banned": [
   "transitions/pagePeel",
   "transitions/bookFlip",
   "transitions/ink"
  ]
 },
 "layers": [
  {
   "kind": "glow",
   "params": {
    "pools": [
     {
      "x": 0.15,
      "y": 0.85,
      "r": 0.5,
      "color": "#FF3EC8",
      "intensity": 0.22
     },
     {
      "x": 0.88,
      "y": 0.12,
      "r": 0.4,
      "color": "#3EC8FF",
      "intensity": 0.18
     }
    ]
   }
  },
  {
   "kind": "bokeh",
   "params": {
    "count": 14,
    "intensity": 0.35,
    "colors": [
     "#FF3EC8",
     "#3EC8FF",
     "#FFD08A"
    ]
   }
  },
  {
   "kind": "grain",
   "params": {
    "stock": "digital-soft"
   }
  }
 ],
 "look": "layers/look.neon-night",
 "grain": "layers/grain.digital-soft",
 "sound": {
  "bed": "music/bed_synthwave_loop8",
  "alt_beds": [
   "music/bed_deep_house_loop8",
   "music/bed_dnb_170_loop8"
  ],
  "families": [
   "whoosh",
   "hit",
   "riser"
  ],
  "sfx": {
   "firstFrame": "sfx/whoosh/scifi_pass",
   "card": "sfx/ui/blip",
   "riser": "sfx/riser/supersaw_2bar",
   "reveal": "sfx/hit/stab",
   "sting": "sfx/logo/ascend_land"
  },
  "foley": "sci-fi passes and a synth stab"
 },
 "signature_features": [
  {
   "text": "the room seen through rain on glass, with light streaks passing in it",
   "check": "lint.style.craft"
  },
  {
   "text": "a slow push-in on every shot (8-20 percent of the distance)",
   "check": "lint.style.craft"
  },
  {
   "text": "bloom 1.2-2.2 on the practicals: the lamp, the neon city, the streaks",
   "check": "lint.style.craft"
  },
  {
   "text": "light ink on deep indigo at 17:1, magenta at 6:1 (contrast.py)",
   "check": "lint.style.palette"
  },
  {
   "text": "light-leak flashes on the emotional cuts",
   "check": "lint.style.transitions"
  },
  {
   "text": "a synthwave bed over the rain",
   "check": "lint.style.sound"
  },
  {
   "text": "magenta and cyan rim light; warm only from the lamp",
   "check": "review"
  }
 ],
 "change_tiers": {
  "safe": [
   "copy",
   "palette.accent within the palette logic",
   "sound.bed among alt_beds",
   "length",
   "aspect"
  ],
  "character": [
   "palette.paper and ink",
   "type.presets",
   "motion.asl_s",
   "layers intensity"
  ],
  "identity": [
   "type.display",
   "transitions.by_reason",
   "layers kinds"
  ]
 },
 "formats": [
  "character-spot",
  "ad",
  "launch-film",
  "saas-feature-drop",
  "proof-clip",
  "explainer"
 ],
 "recipes": [
  "templates/style-scene",
  "templates/ad",
  "transitions/blurCross",
  "transitions/flash",
  "transitions/lightLeak",
  "transitions/zoomThrough",
  "type/blurIn",
  "type/charRise",
  "type/charStagger",
  "type/scaleSlam",
  "music/bed_synthwave_loop8",
  "sfx/hit/stab",
  "sfx/logo/ascend_land",
  "sfx/riser/supersaw_2bar",
  "sfx/ui/blip",
  "sfx/whoosh/scifi_pass",
  "layers/glow",
  "layers/bokeh",
  "layers/grain",
  "layers/look.neon-night",
  "layers/grain.digital-soft",
  "cam2d.crashZoom",
  "cam2d.breathe2d",
  "objects/night-set",
  "objects/lamp",
  "objects/book",
  "objects/worker",
  "objects/mug",
  "objects/rain-glass",
  "sfx/amb/rain",
  "sfx/lift/inhale",
  "sfx/ui/click",
  "sfx/hw/power_on",
  "sfx/paper/flip",
  "sfx/paper/rustle",
  "sfx/ui/success_chime",
  "transitions/cut"
 ],
 "apply": {
  "templates/ad": {
   "plates": false
  },
  "templates/style-scene": {
   "world": "neon",
   "sfx.bed": "sfx/amb/rain",
   "sfx.wake": "sfx/lift/inhale",
   "sfx.tap": "sfx/ui/click",
   "sfx.on": "sfx/hw/power_on",
   "sfx.open": "sfx/paper/flip",
   "sfx.flutter": "sfx/paper/rustle",
   "sfx.delight": "sfx/ui/success_chime",
   "sfx.sting": "sfx/logo/ascend_land"
  }
 },
 "demo": {
  "format": "character-spot",
  "template": "templates/style-scene",
  "seconds": 13.5,
  "aspect": "16:9",
  "status": "pending",
  "preview": "media/styles/neon-night.mp4",
  "tall_preview": "media/styles/neon-night-9x16.mp4",
  "poster": "media/styles/neon-night.jpg",
  "release_asset": "motion-pack-style-neon-night-v0.6.0.mp4"
 },
 "honesty": "The demo is one run of the shared tiny story (a night reading room, a lamp, a book; the title is a labelled placeholder) in this style. The same prompt makes a different film on every run.",
 "world": "neon",
 "craft": {
  "rain": true,
  "streaks": {
   "value": 7,
   "min": 4,
   "max": 10
  },
  "push": {
   "value": 0.12,
   "min": 0.08,
   "max": 0.2,
   "what": "slow push-in per shot"
  },
  "bloom": {
   "value": 1.6,
   "min": 1.2,
   "max": 2.2
  },
  "stepFps": 0,
  "grain": {
   "value": 0.03,
   "min": 0,
   "max": 0.05
  },
  "vignette": {
   "value": 0.3,
   "min": 0.15,
   "max": 0.4
  },
  "dof": {
   "value": 50,
   "min": 20,
   "max": 90
  }
 }
}
