{
 "id": "soft-clay",
 "tier": "hero",
 "title": "Soft Clay",
 "title_zh": "柔软黏土",
 "line": "Stop-motion clay at night: a lilac room, a figure on 2s, squash and stretch, a soft key and a warm lamp.",
 "line_zh": "夜晚的定格黏土：淡紫房间，一拍二的小人，挤压与拉伸，柔和主光与暖色台灯。",
 "prompt": "Soft clay style: a stop-motion clay world animated on 2s, squash and stretch on every tap and landing, a soft moonlight key and a warm lamp pool, lilac set, plum ink, hard cuts, a lo-fi bed with pops and a boing.",
 "prompt_zh": "柔软黏土风格：一拍二的定格黏土世界，每次轻点和落地都有挤压拉伸，柔和月光主光与暖色台灯光池，淡紫布景、深梅色文字、硬切，低保真配乐配弹出声与弹簧声。",
 "essence": "A tiny clay world shot frame by frame: poses held on 2s, soft bodies that squash when they land, one soft key and one warm practical. It feels handmade and warm, never glossy.",
 "not": [
  {
   "style": "paper-cut",
   "difference": "Paper Cut is flat craft layers; Soft Clay is rounded 3D under studio light."
  },
  {
   "style": "kinetic-poster",
   "difference": "Kinetic Poster is loud flat type; Soft Clay is quiet 3D with small type."
  }
 ],
 "palette": {
  "logic": "a pale lilac set, dark plum ink, ONE friendly purple that matches the clay figures",
  "paper": "#F1ECF7",
  "ink": "#2B2340",
  "accent": "#6A4BD6",
  "muted": "#5F5875",
  "contrast": {
   "ink_on_paper": 12.76,
   "muted_on_paper": 5.76,
   "accent_on_paper": 5.04
  }
 },
 "type": {
  "display": "Manrope",
  "text": "Manrope",
  "weight": 800,
  "case": "sentence",
  "max_words_per_line": 4,
  "presets": {
   "headline": "type/elasticPop",
   "card": "type/charRise",
   "end": "type/elasticPop",
   "sub": "type/blurIn"
  }
 },
 "motion": {
  "personality": "playful",
  "ease": "pop",
  "overshoot_max": 0.15,
  "asl_s": [
   1.2,
   2.2
  ],
  "camera": [
   {
    "move": "cam3d.orbit",
    "expresses": "a turn around the clay set"
   },
   {
    "move": "cam3d.pushSlow",
    "expresses": "a gentle move toward a figure"
   }
  ]
 },
 "transitions": {
  "by_reason": {
   "EMOTION": "transitions/cut",
   "STORY": "transitions/cut",
   "RHYTHM": "transitions/cut",
   "ENERGY": "transitions/swipeUp"
  },
  "banned": [
   "transitions/glitch",
   "transitions/tvStatic",
   "transitions/filmBurn",
   "transitions/pixelSort"
  ]
 },
 "layers": [
  {
   "kind": "bokeh",
   "params": {
    "count": 10,
    "intensity": 0.2,
    "colors": [
     "#FFFFFF",
     "#D9CCF5"
    ]
   }
  },
  {
   "kind": "vignette",
   "params": {
    "amount": 0.15
   }
  },
  {
   "kind": "grain",
   "params": {
    "stock": "clean",
    "amount": 0.02
   }
  }
 ],
 "look": "layers/look.pastel",
 "grain": "layers/grain.clean",
 "sound": {
  "bed": "music/bed_lofi_warm_loop8",
  "alt_beds": [
   "music/bed_playful_bounce_loop8",
   "music/bed_acoustic_folk_pluck_loop8"
  ],
  "families": [
   "ui",
   "cartoon"
  ],
  "sfx": {
   "firstFrame": "sfx/ui/pop",
   "card": "sfx/ui/pop_down",
   "riser": "sfx/cartoon/xylo_up",
   "reveal": "sfx/cartoon/boing",
   "sting": "sfx/logo/fifth_lift"
  },
  "foley": "pops, a xylophone run and a boing"
 },
 "signature_features": [
  {
   "text": "animated on 2s: every pose, prop and camera move held 2 frames (stepFps 15), no motion blur",
   "check": "lint.style.craft"
  },
  {
   "text": "squash and stretch of 0.12-0.32 on the tap and the landing, volume kept",
   "check": "lint.style.craft"
  },
  {
   "text": "a soft key: moonlight through the window with a wide shadow radius, a warm lamp pool; clay materials only",
   "check": "review"
  },
  {
   "text": "dark plum ink on lilac at 12:1, purple at 5:1 (contrast.py)",
   "check": "lint.style.palette"
  },
  {
   "text": "hard cuts between locked-off shots with a gentle push (under 8 percent)",
   "check": "lint.style.transitions"
  },
  {
   "text": "a warm lo-fi bed with pops and a boing",
   "check": "lint.style.sound"
  }
 ],
 "change_tiers": {
  "safe": [
   "copy",
   "palette.accent within the palette logic",
   "sound.bed among alt_beds",
   "length",
   "aspect"
  ],
  "character": [
   "palette.paper and ink",
   "type.presets",
   "motion.asl_s",
   "layers intensity"
  ],
  "identity": [
   "type.display",
   "transitions.by_reason",
   "layers kinds"
  ]
 },
 "formats": [
  "character-spot",
  "ad",
  "launch-film",
  "saas-feature-drop",
  "proof-clip",
  "explainer"
 ],
 "recipes": [
  "templates/style-scene",
  "templates/ad",
  "transitions/dissolve",
  "transitions/swipeUp",
  "type/blurIn",
  "type/charRise",
  "type/elasticPop",
  "music/bed_lofi_warm_loop8",
  "sfx/cartoon/boing",
  "sfx/cartoon/xylo_up",
  "sfx/logo/fifth_lift",
  "sfx/ui/pop",
  "sfx/ui/pop_down",
  "layers/bokeh",
  "layers/vignette",
  "layers/grain",
  "layers/look.pastel",
  "layers/grain.clean",
  "cam3d.orbit",
  "cam3d.pushSlow",
  "objects/night-set",
  "objects/lamp",
  "objects/book",
  "objects/worker",
  "objects/mug",
  "objects/clay",
  "sfx/amb/room_tone",
  "sfx/lift/inhale",
  "sfx/hw/power_on",
  "sfx/paper/flip",
  "sfx/paper/rustle",
  "transitions/cut"
 ],
 "apply": {
  "templates/ad": {
   "plates": true,
   "hook.media": "plate-cast.mp4",
   "hook.mediaStart": 0.6,
   "hook.label": "the clay cast (pack render)",
   "product.media": "plate-devices.mp4",
   "product.mediaStart": 1.4,
   "product.label": "the clay desk (pack render)"
  },
  "templates/style-scene": {
   "world": "clay",
   "sfx.bed": "sfx/amb/room_tone",
   "sfx.wake": "sfx/lift/inhale",
   "sfx.tap": "sfx/ui/pop",
   "sfx.on": "sfx/hw/power_on",
   "sfx.open": "sfx/paper/flip",
   "sfx.flutter": "sfx/paper/rustle",
   "sfx.delight": "sfx/cartoon/boing",
   "sfx.sting": "sfx/logo/fifth_lift"
  }
 },
 "demo": {
  "format": "character-spot",
  "template": "templates/style-scene",
  "seconds": 13.5,
  "aspect": "16:9",
  "status": "rendered",
  "preview": "media/styles/soft-clay.mp4",
  "tall_preview": "media/styles/soft-clay-9x16.mp4",
  "poster": "media/styles/soft-clay.jpg",
  "release_asset": "motion-pack-style-soft-clay-v0.6.0.mp4",
  "lint": "mp lint --format character-spot: 16:9 94.2/100, 48 PASS, 6 WARN, 0 FAIL, 0 INFO, 15 N/A; 9:16 94.2/100, 48 PASS, 6 WARN, 0 FAIL, 0 INFO, 15 N/A",
  "sheet": "release assets: style-soft-clay.sheet.jpg",
  "made_by": "Claude Code (Opus 5.5): mp plan character-spot --style soft-clay --template style-scene, mp new, mp render 16:9 + 9:16 (render-lock, CRF 18), mp lint; 3 render rounds (type size, a documentary frame 0, the 9:16 lower third), 0 human rounds, 21 Oct 2026"
 },
 "honesty": "The demo is one run of the shared tiny story (a night reading room, a lamp, a book; the title is a labelled placeholder) in this style. The same prompt makes a different film on every run.",
 "world": "clay",
 "craft": {
  "stepFps": 15,
  "squash": {
   "value": 0.22,
   "min": 0.12,
   "max": 0.32,
   "what": "peak squash of the tap and the landing"
  },
  "push": {
   "value": 0.04,
   "min": 0,
   "max": 0.08
  },
  "handheld": 0,
  "rackFocus": false,
  "grain": {
   "value": 0.015,
   "min": 0,
   "max": 0.03
  },
  "bloom": {
   "value": 0.9,
   "min": 0.7,
   "max": 1.2
  },
  "dof": {
   "value": 40,
   "min": 20,
   "max": 60
  },
  "vignette": {
   "value": 0.12,
   "min": 0.05,
   "max": 0.2
  }
 }
}
